======================================================================
Flow Completion Time (FCT) Analysis - Task 4
======================================================================
Output File: /Users/zhouzhixiang/Library/CloudStorage/OneDrive-个人/high speed/spcl_HTSIM/htsim/sim/datacenter/assignment2/task4/results/congestion_oblivious.out
Connection Matrix: congestion_scenario.cm

Expected Flows: 32
Completed Flows: 32

======================================================================
Individual Flow Results
======================================================================

Flow 1: flow_0_16
  Route: 0 -> 16
  Size: 50,000,000 bytes (47.68 MB)
  FCT: 21187.20 us (21.19 ms)
  Throughput: 18.88 Gbps
  Time: 13.50 -> 21200.70 us
  DCTCP Events: 15323

Flow 2: flow_1_16
  Route: 1 -> 16
  Size: 50,000,000 bytes (47.68 MB)
  FCT: 23533.48 us (23.53 ms)
  Throughput: 17.00 Gbps
  Time: 13.62 -> 23547.10 us
  DCTCP Events: 19328

Flow 3: flow_2_16
  Route: 2 -> 16
  Size: 50,000,000 bytes (47.68 MB)
  FCT: 20088.52 us (20.09 ms)
  Throughput: 19.91 Gbps
  Time: 13.98 -> 20102.50 us
  DCTCP Events: 16174

Flow 4: flow_3_16
  Route: 3 -> 16
  Size: 50,000,000 bytes (47.68 MB)
  FCT: 20834.80 us (20.83 ms)
  Throughput: 19.20 Gbps
  Time: 14.10 -> 20848.90 us
  DCTCP Events: 17630

Flow 5: flow_4_32
  Route: 4 -> 32
  Size: 50,000,000 bytes (47.68 MB)
  FCT: 24876.10 us (24.88 ms)
  Throughput: 16.08 Gbps
  Time: 13.50 -> 24889.60 us
  DCTCP Events: 17168

Flow 6: flow_5_32
  Route: 5 -> 32
  Size: 50,000,000 bytes (47.68 MB)
  FCT: 21475.58 us (21.48 ms)
  Throughput: 18.63 Gbps
  Time: 13.62 -> 21489.20 us
  DCTCP Events: 14147

Flow 7: flow_6_32
  Route: 6 -> 32
  Size: 50,000,000 bytes (47.68 MB)
  FCT: 22347.72 us (22.35 ms)
  Throughput: 17.90 Gbps
  Time: 13.98 -> 22361.70 us
  DCTCP Events: 14037

Flow 8: flow_7_32
  Route: 7 -> 32
  Size: 50,000,000 bytes (47.68 MB)
  FCT: 24779.26 us (24.78 ms)
  Throughput: 16.14 Gbps
  Time: 14.94 -> 24794.20 us
  DCTCP Events: 16405

Flow 9: flow_8_48
  Route: 8 -> 48
  Size: 100,000,000 bytes (95.37 MB)
  FCT: 37587.60 us (37.59 ms)
  Throughput: 21.28 Gbps
  Time: 100.00 -> 37687.60 us
  DCTCP Events: 25140

Flow 10: flow_9_48
  Route: 9 -> 48
  Size: 100,000,000 bytes (95.37 MB)
  FCT: 39502.60 us (39.50 ms)
  Throughput: 20.25 Gbps
  Time: 100.00 -> 39602.60 us
  DCTCP Events: 25672

Flow 11: flow_10_48
  Route: 10 -> 48
  Size: 100,000,000 bytes (95.37 MB)
  FCT: 41193.40 us (41.19 ms)
  Throughput: 19.42 Gbps
  Time: 100.00 -> 41293.40 us
  DCTCP Events: 28445

Flow 12: flow_11_48
  Route: 11 -> 48
  Size: 100,000,000 bytes (95.37 MB)
  FCT: 40833.30 us (40.83 ms)
  Throughput: 19.59 Gbps
  Time: 100.00 -> 40933.30 us
  DCTCP Events: 28069

Flow 13: flow_12_64
  Route: 12 -> 64
  Size: 100,000,000 bytes (95.37 MB)
  FCT: 33203.70 us (33.20 ms)
  Throughput: 24.09 Gbps
  Time: 100.00 -> 33303.70 us
  DCTCP Events: 26216

Flow 14: flow_13_64
  Route: 13 -> 64
  Size: 100,000,000 bytes (95.37 MB)
  FCT: 39638.60 us (39.64 ms)
  Throughput: 20.18 Gbps
  Time: 100.00 -> 39738.60 us
  DCTCP Events: 33426

Flow 15: flow_14_64
  Route: 14 -> 64
  Size: 100,000,000 bytes (95.37 MB)
  FCT: 38341.50 us (38.34 ms)
  Throughput: 20.87 Gbps
  Time: 100.00 -> 38441.50 us
  DCTCP Events: 31407

Flow 16: flow_15_64
  Route: 15 -> 64
  Size: 100,000,000 bytes (95.37 MB)
  FCT: 34238.70 us (34.24 ms)
  Throughput: 23.37 Gbps
  Time: 100.00 -> 34338.70 us
  DCTCP Events: 30423

Flow 17: flow_17_80
  Route: 17 -> 80
  Size: 20,000,000 bytes (19.07 MB)
  FCT: 5488.81 us (5.49 ms)
  Throughput: 29.15 Gbps
  Time: 200.00 -> 5688.81 us
  DCTCP Events: 3495

Flow 18: flow_18_81
  Route: 18 -> 81
  Size: 20,000,000 bytes (19.07 MB)
  FCT: 5088.19 us (5.09 ms)
  Throughput: 31.45 Gbps
  Time: 200.00 -> 5288.19 us
  DCTCP Events: 3286

Flow 19: flow_19_82
  Route: 19 -> 82
  Size: 20,000,000 bytes (19.07 MB)
  FCT: 7301.62 us (7.30 ms)
  Throughput: 21.91 Gbps
  Time: 200.00 -> 7501.62 us
  DCTCP Events: 5680

Flow 20: flow_20_83
  Route: 20 -> 83
  Size: 20,000,000 bytes (19.07 MB)
  FCT: 6611.34 us (6.61 ms)
  Throughput: 24.20 Gbps
  Time: 200.00 -> 6811.34 us
  DCTCP Events: 4760

Flow 21: flow_21_84
  Route: 21 -> 84
  Size: 20,000,000 bytes (19.07 MB)
  FCT: 6084.96 us (6.08 ms)
  Throughput: 26.29 Gbps
  Time: 200.00 -> 6284.96 us
  DCTCP Events: 4429

Flow 22: flow_22_85
  Route: 22 -> 85
  Size: 20,000,000 bytes (19.07 MB)
  FCT: 6153.16 us (6.15 ms)
  Throughput: 26.00 Gbps
  Time: 200.00 -> 6353.16 us
  DCTCP Events: 4336

Flow 23: flow_23_86
  Route: 23 -> 86
  Size: 20,000,000 bytes (19.07 MB)
  FCT: 6340.88 us (6.34 ms)
  Throughput: 25.23 Gbps
  Time: 200.00 -> 6540.88 us
  DCTCP Events: 4717

Flow 24: flow_24_87
  Route: 24 -> 87
  Size: 20,000,000 bytes (19.07 MB)
  FCT: 5105.51 us (5.11 ms)
  Throughput: 31.34 Gbps
  Time: 200.00 -> 5305.51 us
  DCTCP Events: 3818

Flow 25: flow_33_96
  Route: 33 -> 96
  Size: 150,000,000 bytes (143.05 MB)
  FCT: 33315.90 us (33.32 ms)
  Throughput: 36.02 Gbps
  Time: 300.00 -> 33615.90 us
  DCTCP Events: 22365

Flow 26: flow_34_97
  Route: 34 -> 97
  Size: 150,000,000 bytes (143.05 MB)
  FCT: 31962.10 us (31.96 ms)
  Throughput: 37.54 Gbps
  Time: 300.00 -> 32262.10 us
  DCTCP Events: 21016

Flow 27: flow_35_98
  Route: 35 -> 98
  Size: 150,000,000 bytes (143.05 MB)
  FCT: 33789.70 us (33.79 ms)
  Throughput: 35.51 Gbps
  Time: 300.00 -> 34089.70 us
  DCTCP Events: 21981

Flow 28: flow_36_99
  Route: 36 -> 99
  Size: 150,000,000 bytes (143.05 MB)
  FCT: 36605.50 us (36.61 ms)
  Throughput: 32.78 Gbps
  Time: 300.00 -> 36905.50 us
  DCTCP Events: 28432

Flow 29: flow_49_100
  Route: 49 -> 100
  Size: 80,000,000 bytes (76.29 MB)
  FCT: 27321.90 us (27.32 ms)
  Throughput: 23.42 Gbps
  Time: 400.00 -> 27721.90 us
  DCTCP Events: 20599

Flow 30: flow_50_101
  Route: 50 -> 101
  Size: 80,000,000 bytes (76.29 MB)
  FCT: 28198.60 us (28.20 ms)
  Throughput: 22.70 Gbps
  Time: 400.00 -> 28598.60 us
  DCTCP Events: 23215

Flow 31: flow_51_102
  Route: 51 -> 102
  Size: 80,000,000 bytes (76.29 MB)
  FCT: 27225.20 us (27.23 ms)
  Throughput: 23.51 Gbps
  Time: 400.00 -> 27625.20 us
  DCTCP Events: 21634

Flow 32: flow_52_103
  Route: 52 -> 103
  Size: 80,000,000 bytes (76.29 MB)
  FCT: 28441.30 us (28.44 ms)
  Throughput: 22.50 Gbps
  Time: 400.00 -> 28841.30 us
  DCTCP Events: 21686

======================================================================
Overall FCT Statistics
======================================================================
  Total Flows: 32
  Mean FCT: 24334.27 us (24.33 ms)
  Median FCT: 26050.65 us (26.05 ms)
  Min FCT: 5088.19 us (5.09 ms)
  Max FCT: 41193.40 us (41.19 ms)
  Std Dev: 12362.27 us
  Variance: 152825629.34
  P50: 27225.20 us (27.23 ms)
  P95: 40833.30 us (40.83 ms)
  P99: 41193.40 us (41.19 ms)

======================================================================
Overall Throughput Statistics
======================================================================
  Mean Throughput: 23.82 Gbps
  Median Throughput: 22.60 Gbps
  Min Throughput: 16.08 Gbps
  Max Throughput: 37.54 Gbps

======================================================================
Analysis by Flow Size
======================================================================

SMALL Flows (n=16):
  Mean FCT: 14206.07 us (14.21 ms)
  Median FCT: 13695.07 us (13.70 ms)
  Min FCT: 5088.19 us
  Max FCT: 24876.10 us

MEDIUM Flows (n=12):
  Mean FCT: 34643.87 us (34.64 ms)
  Median FCT: 35913.15 us (35.91 ms)
  Min FCT: 27225.20 us
  Max FCT: 41193.40 us

LARGE Flows (n=4):
  Mean FCT: 33918.30 us (33.92 ms)
  Median FCT: 33552.80 us (33.55 ms)
  Min FCT: 31962.10 us
  Max FCT: 36605.50 us

======================================================================
Incast Pattern Analysis
======================================================================

Receiver 16: 4 senders
  Senders: [0, 1, 2, 3]
  Mean FCT: 21411.00 us (21.41 ms)
  Max FCT: 23533.48 us (23.53 ms)
  FCT Variance: 2211989.32

Receiver 32: 4 senders
  Senders: [4, 5, 6, 7]
  Mean FCT: 23369.66 us (23.37 ms)
  Max FCT: 24876.10 us (24.88 ms)
  FCT Variance: 2962744.59

Receiver 48: 4 senders
  Senders: [8, 9, 10, 11]
  Mean FCT: 39779.22 us (39.78 ms)
  Max FCT: 41193.40 us (41.19 ms)
  FCT Variance: 2663568.86

Receiver 64: 4 senders
  Senders: [12, 13, 14, 15]
  Mean FCT: 36355.62 us (36.36 ms)
  Max FCT: 39638.60 us (39.64 ms)
  FCT Variance: 9712542.34

======================================================================
Analysis Complete
======================================================================
