======================================================================
Flow Completion Time (FCT) Analysis - Task 4
======================================================================
Output File: /Users/ziqiaozhu/Desktop/nyu/HighSpeedNetwork/High-Speed-Proposal/htsim/sim/datacenter/assignment2/task4/results/congestion_reps.out
Connection Matrix: congestion_scenario.cm

Expected Flows: 32
Completed Flows: 32

======================================================================
Individual Flow Results
======================================================================

Flow 1: flow_0_16
  Route: 0 -> 16
  Size: 50,000,000 bytes (47.68 MB)
  FCT: 22306.00 us (22.31 ms)
  Throughput: 17.93 Gbps
  Time: 13.50 -> 22319.50 us
  DCTCP Events: 17400

Flow 2: flow_1_16
  Route: 1 -> 16
  Size: 50,000,000 bytes (47.68 MB)
  FCT: 24052.46 us (24.05 ms)
  Throughput: 16.63 Gbps
  Time: 13.74 -> 24066.20 us
  DCTCP Events: 20954

Flow 3: flow_2_16
  Route: 2 -> 16
  Size: 50,000,000 bytes (47.68 MB)
  FCT: 23534.08 us (23.53 ms)
  Throughput: 17.00 Gbps
  Time: 13.62 -> 23547.70 us
  DCTCP Events: 19198

Flow 4: flow_3_16
  Route: 3 -> 16
  Size: 50,000,000 bytes (47.68 MB)
  FCT: 23366.86 us (23.37 ms)
  Throughput: 17.12 Gbps
  Time: 14.94 -> 23381.80 us
  DCTCP Events: 20369

Flow 5: flow_4_32
  Route: 4 -> 32
  Size: 50,000,000 bytes (47.68 MB)
  FCT: 22611.00 us (22.61 ms)
  Throughput: 17.69 Gbps
  Time: 13.50 -> 22624.50 us
  DCTCP Events: 13431

Flow 6: flow_5_32
  Route: 5 -> 32
  Size: 50,000,000 bytes (47.68 MB)
  FCT: 22333.58 us (22.33 ms)
  Throughput: 17.91 Gbps
  Time: 13.62 -> 22347.20 us
  DCTCP Events: 13003

Flow 7: flow_6_32
  Route: 6 -> 32
  Size: 50,000,000 bytes (47.68 MB)
  FCT: 22294.36 us (22.29 ms)
  Throughput: 17.94 Gbps
  Time: 13.74 -> 22308.10 us
  DCTCP Events: 12832

Flow 8: flow_7_32
  Route: 7 -> 32
  Size: 50,000,000 bytes (47.68 MB)
  FCT: 21234.72 us (21.23 ms)
  Throughput: 18.84 Gbps
  Time: 13.98 -> 21248.70 us
  DCTCP Events: 13124

Flow 9: flow_8_48
  Route: 8 -> 48
  Size: 100,000,000 bytes (95.37 MB)
  FCT: 38370.40 us (38.37 ms)
  Throughput: 20.85 Gbps
  Time: 100.00 -> 38470.40 us
  DCTCP Events: 24062

Flow 10: flow_9_48
  Route: 9 -> 48
  Size: 100,000,000 bytes (95.37 MB)
  FCT: 38196.70 us (38.20 ms)
  Throughput: 20.94 Gbps
  Time: 100.00 -> 38296.70 us
  DCTCP Events: 23600

Flow 11: flow_10_48
  Route: 10 -> 48
  Size: 100,000,000 bytes (95.37 MB)
  FCT: 38235.10 us (38.24 ms)
  Throughput: 20.92 Gbps
  Time: 100.00 -> 38335.10 us
  DCTCP Events: 23903

Flow 12: flow_11_48
  Route: 11 -> 48
  Size: 100,000,000 bytes (95.37 MB)
  FCT: 37802.70 us (37.80 ms)
  Throughput: 21.16 Gbps
  Time: 100.00 -> 37902.70 us
  DCTCP Events: 24898

Flow 13: flow_12_64
  Route: 12 -> 64
  Size: 100,000,000 bytes (95.37 MB)
  FCT: 39300.10 us (39.30 ms)
  Throughput: 20.36 Gbps
  Time: 100.00 -> 39400.10 us
  DCTCP Events: 31333

Flow 14: flow_13_64
  Route: 13 -> 64
  Size: 100,000,000 bytes (95.37 MB)
  FCT: 39308.90 us (39.31 ms)
  Throughput: 20.35 Gbps
  Time: 100.00 -> 39408.90 us
  DCTCP Events: 30132

Flow 15: flow_14_64
  Route: 14 -> 64
  Size: 100,000,000 bytes (95.37 MB)
  FCT: 37941.90 us (37.94 ms)
  Throughput: 21.08 Gbps
  Time: 100.00 -> 38041.90 us
  DCTCP Events: 31419

Flow 16: flow_15_64
  Route: 15 -> 64
  Size: 100,000,000 bytes (95.37 MB)
  FCT: 38611.90 us (38.61 ms)
  Throughput: 20.72 Gbps
  Time: 100.00 -> 38711.90 us
  DCTCP Events: 30971

Flow 17: flow_17_80
  Route: 17 -> 80
  Size: 20,000,000 bytes (19.07 MB)
  FCT: 5187.19 us (5.19 ms)
  Throughput: 30.85 Gbps
  Time: 200.00 -> 5387.19 us
  DCTCP Events: 3766

Flow 18: flow_18_81
  Route: 18 -> 81
  Size: 20,000,000 bytes (19.07 MB)
  FCT: 5020.52 us (5.02 ms)
  Throughput: 31.87 Gbps
  Time: 200.00 -> 5220.52 us
  DCTCP Events: 3592

Flow 19: flow_19_82
  Route: 19 -> 82
  Size: 20,000,000 bytes (19.07 MB)
  FCT: 4967.10 us (4.97 ms)
  Throughput: 32.21 Gbps
  Time: 200.00 -> 5167.10 us
  DCTCP Events: 3465

Flow 20: flow_20_83
  Route: 20 -> 83
  Size: 20,000,000 bytes (19.07 MB)
  FCT: 4715.56 us (4.72 ms)
  Throughput: 33.93 Gbps
  Time: 200.00 -> 4915.56 us
  DCTCP Events: 3264

Flow 21: flow_21_84
  Route: 21 -> 84
  Size: 20,000,000 bytes (19.07 MB)
  FCT: 4990.86 us (4.99 ms)
  Throughput: 32.06 Gbps
  Time: 200.00 -> 5190.86 us
  DCTCP Events: 3645

Flow 22: flow_22_85
  Route: 22 -> 85
  Size: 20,000,000 bytes (19.07 MB)
  FCT: 4776.60 us (4.78 ms)
  Throughput: 33.50 Gbps
  Time: 200.00 -> 4976.60 us
  DCTCP Events: 3196

Flow 23: flow_23_86
  Route: 23 -> 86
  Size: 20,000,000 bytes (19.07 MB)
  FCT: 4313.63 us (4.31 ms)
  Throughput: 37.09 Gbps
  Time: 200.00 -> 4513.63 us
  DCTCP Events: 2901

Flow 24: flow_24_87
  Route: 24 -> 87
  Size: 20,000,000 bytes (19.07 MB)
  FCT: 4856.71 us (4.86 ms)
  Throughput: 32.94 Gbps
  Time: 200.00 -> 5056.71 us
  DCTCP Events: 3345

Flow 25: flow_33_96
  Route: 33 -> 96
  Size: 150,000,000 bytes (143.05 MB)
  FCT: 25498.90 us (25.50 ms)
  Throughput: 47.06 Gbps
  Time: 300.00 -> 25798.90 us
  DCTCP Events: 17809

Flow 26: flow_34_97
  Route: 34 -> 97
  Size: 150,000,000 bytes (143.05 MB)
  FCT: 25169.10 us (25.17 ms)
  Throughput: 47.68 Gbps
  Time: 300.00 -> 25469.10 us
  DCTCP Events: 17768

Flow 27: flow_35_98
  Route: 35 -> 98
  Size: 150,000,000 bytes (143.05 MB)
  FCT: 24754.40 us (24.75 ms)
  Throughput: 48.48 Gbps
  Time: 300.00 -> 25054.40 us
  DCTCP Events: 17102

Flow 28: flow_36_99
  Route: 36 -> 99
  Size: 150,000,000 bytes (143.05 MB)
  FCT: 25056.60 us (25.06 ms)
  Throughput: 47.89 Gbps
  Time: 300.00 -> 25356.60 us
  DCTCP Events: 17223

Flow 29: flow_49_100
  Route: 49 -> 100
  Size: 80,000,000 bytes (76.29 MB)
  FCT: 16756.90 us (16.76 ms)
  Throughput: 38.19 Gbps
  Time: 400.00 -> 17156.90 us
  DCTCP Events: 11247

Flow 30: flow_50_101
  Route: 50 -> 101
  Size: 80,000,000 bytes (76.29 MB)
  FCT: 16843.30 us (16.84 ms)
  Throughput: 38.00 Gbps
  Time: 400.00 -> 17243.30 us
  DCTCP Events: 11142

Flow 31: flow_51_102
  Route: 51 -> 102
  Size: 80,000,000 bytes (76.29 MB)
  FCT: 17312.40 us (17.31 ms)
  Throughput: 36.97 Gbps
  Time: 400.00 -> 17712.40 us
  DCTCP Events: 11624

Flow 32: flow_52_103
  Route: 52 -> 103
  Size: 80,000,000 bytes (76.29 MB)
  FCT: 17921.20 us (17.92 ms)
  Throughput: 35.71 Gbps
  Time: 400.00 -> 18321.20 us
  DCTCP Events: 12360

======================================================================
Overall FCT Statistics
======================================================================
  Total Flows: 32
  Mean FCT: 21801.30 us (21.80 ms)
  Median FCT: 22472.29 us (22.47 ms)
  Min FCT: 4313.63 us (4.31 ms)
  Max FCT: 39308.90 us (39.31 ms)
  Std Dev: 12267.77 us
  Variance: 150498302.73
  P50: 22611.00 us (22.61 ms)
  P95: 39300.10 us (39.30 ms)
  P99: 39308.90 us (39.31 ms)

======================================================================
Overall Throughput Statistics
======================================================================
  Mean Throughput: 28.50 Gbps
  Median Throughput: 26.00 Gbps
  Min Throughput: 16.63 Gbps
  Max Throughput: 48.48 Gbps

======================================================================
Analysis by Flow Size
======================================================================

SMALL Flows (n=16):
  Mean FCT: 13785.08 us (13.79 ms)
  Median FCT: 13210.95 us (13.21 ms)
  Min FCT: 4313.63 us
  Max FCT: 24052.46 us

MEDIUM Flows (n=12):
  Mean FCT: 31383.46 us (31.38 ms)
  Median FCT: 38069.30 us (38.07 ms)
  Min FCT: 16756.90 us
  Max FCT: 39308.90 us

LARGE Flows (n=4):
  Mean FCT: 25119.75 us (25.12 ms)
  Median FCT: 25112.85 us (25.11 ms)
  Min FCT: 24754.40 us
  Max FCT: 25498.90 us

======================================================================
Incast Pattern Analysis
======================================================================

Receiver 16: 4 senders
  Senders: [0, 1, 2, 3]
  Mean FCT: 23314.85 us (23.31 ms)
  Max FCT: 24052.46 us (24.05 ms)
  FCT Variance: 537537.89

Receiver 32: 4 senders
  Senders: [4, 5, 6, 7]
  Mean FCT: 22118.41 us (22.12 ms)
  Max FCT: 22611.00 us (22.61 ms)
  FCT Variance: 366936.49

Receiver 48: 4 senders
  Senders: [8, 9, 10, 11]
  Mean FCT: 38151.22 us (38.15 ms)
  Max FCT: 38370.40 us (38.37 ms)
  FCT Variance: 59536.78

Receiver 64: 4 senders
  Senders: [12, 13, 14, 15]
  Mean FCT: 38790.70 us (38.79 ms)
  Max FCT: 39308.90 us (39.31 ms)
  FCT Variance: 426816.83

======================================================================
Analysis Complete
======================================================================
